{
  "$schema": "https://json-schema.org/draft/2020-12/schema",
  "title": "Ralleh Agent Template",
  "type": "object",
  "required": ["id", "name", "version", "path"],
  "properties": {
    "id": { "type": "string" },
    "name": { "type": "string" },
    "version": { "type": "string" },
    "description": { "type": "string" },
    "path": { "type": "string" },
    "baselineFiles": {
      "type": "array",
      "items": { "type": "string" }
    },
    "tags": {
      "type": "array",
      "items": { "type": "string" }
    }
  },
  "additionalProperties": true
}
